{
  "checks": [
    {
      "name": "offline_doctor_core",
      "observed": "local_package=installed; bundled_cli=bundled; schemas=available",
      "passed": true,
      "required": "local package, CLI, and schemas pass offline doctor"
    },
    {
      "name": "contract_card_verifies",
      "observed": "library_contract_locked",
      "passed": true,
      "required": "public API/CLI/schema contract verifies"
    },
    {
      "name": "artifact_card_verifies",
      "observed": "review_ready_smoke",
      "passed": true,
      "required": "artifact-review packet verifies"
    },
    {
      "name": "reproduction_card_verifies",
      "observed": "reviewer_replay_ready_smoke",
      "passed": true,
      "required": "reviewer reproduction packet verifies"
    },
    {
      "name": "release_card_verifies",
      "observed": "local_release_candidate",
      "passed": true,
      "required": "release trust card verifies"
    },
    {
      "name": "release_evidence_verifies",
      "observed": "release_evidence_ready",
      "passed": false,
      "required": "release evidence packet verifies"
    },
    {
      "name": "crates_card_verifies",
      "observed": "publish_plan_locked",
      "passed": true,
      "required": "crates staged-publish card verifies"
    },
    {
      "name": "install_card_verifies",
      "observed": "full_cli_install_ready",
      "passed": true,
      "required": "clean-wheel installability card verifies"
    },
    {
      "name": "research_card_verifies",
      "observed": "research_basis_locked",
      "passed": true,
      "required": "research-basis card verifies"
    },
    {
      "name": "paper_manifest_verifies",
      "observed": 43,
      "passed": true,
      "required": "paper manifest and bound result verify"
    },
    {
      "name": "schemas_available",
      "observed": "19/19",
      "passed": true,
      "required": "all shipped TRICE schemas are present"
    },
    {
      "name": "workflows_bound",
      "observed": "release_workflow=ok; ci_workflow=ok; scorecard_workflow=ok",
      "passed": true,
      "required": "CI, release, and Scorecard workflows contain integrity/provenance hooks"
    },
    {
      "name": "claim_honesty_bound",
      "observed": "claim_allowed=False public_release_ready=False",
      "passed": true,
      "required": "smoke evidence remains a non-S-tier claim"
    }
  ],
  "doctor_snapshot": {
    "checks": {
      "bundled_cli": {
        "detail": "/home/user/TraceRazor/tracerazor/bin/tracerazor; binary=1.2.0",
        "ok": true,
        "status": "bundled"
      },
      "crates_io": {
        "detail": "offline mode",
        "ok": null,
        "status": "skipped"
      },
      "github_actions": {
        "detail": "offline mode",
        "ok": null,
        "status": "skipped"
      },
      "github_tag": {
        "detail": "head=1cab6f971602 local_tag=False remote_tag=False",
        "ok": false,
        "status": "pending"
      },
      "local_package": {
        "detail": "version 1.2.0",
        "ok": true,
        "status": "installed"
      },
      "openssf_scorecard": {
        "detail": "offline mode",
        "ok": null,
        "status": "skipped"
      },
      "piwheels": {
        "detail": "offline mode",
        "ok": null,
        "status": "skipped"
      },
      "pypi": {
        "detail": "offline mode",
        "ok": null,
        "status": "skipped"
      },
      "schemas": {
        "detail": "19 schemas",
        "ok": true,
        "status": "available"
      }
    },
    "local_version": "1.2.0",
    "offline": true,
    "package": "tracerazor",
    "platform": "Linux-6.18.44-fc-v37-x86_64-with-glibc2.39",
    "python": "3.11.15",
    "schema_version": "trice-doctor/v1",
    "summary": {
      "failed": [
        "github_tag"
      ],
      "ok": false,
      "unknown": [
        "pypi",
        "piwheels",
        "crates_io",
        "github_actions",
        "openssf_scorecard"
      ]
    }
  },
  "doctor_snapshot_sha256": "cc332efd1781a805f2a922a4d620f43b48baa3297b862ba0b2daa99d98ff7a0f",
  "inputs": {
    "artifact_card": {
      "bytes": 16185,
      "name": "trice_artifact_card.json",
      "path": "docs/trice_artifact_card.json",
      "present": true,
      "sha256": "b35e4ad0fb2afc7d57f28f4b19e1b953acc65c4d1f5ef8fe66e9ba4ca494914a"
    },
    "contract_card": {
      "bytes": 19194,
      "name": "trice_contract_card.json",
      "path": "docs/trice_contract_card.json",
      "present": true,
      "sha256": "ced41a779dff9e8c3c17752a78fb505b09115d09a745e2c2db0293a12753d233"
    },
    "crates_card": {
      "bytes": 21470,
      "name": "trice_crates_card.json",
      "path": "docs/trice_crates_card.json",
      "present": true,
      "sha256": "9acfef9b530c374406ca39cf541497528f11ad01c76a6ea16efe4cd5413683e8"
    },
    "install_card": {
      "bytes": 13925,
      "name": "trice_install_card.json",
      "path": "docs/trice_install_card.json",
      "present": true,
      "sha256": "a901c24a391d869c77362552666b10fbf3d048b7c10b20cce317d4397f038e45"
    },
    "paper_manifest": {
      "bytes": 7364,
      "name": "trice_v3_research_manifest.json",
      "path": "paper/trice_v3_research_manifest.json",
      "present": true,
      "sha256": "4ca9de56f71c5498f84fdda4fdbc955bd5b0adcc45f7bb64869aa032010fb60a"
    },
    "paper_result": {
      "bytes": 45736,
      "name": "trice_v2_live_results.json",
      "path": "benchmark/trice/results/v2-smoke/trice_v2_live_results.json",
      "present": true,
      "sha256": "edf72f856f37e2c773ffefc31c2ae0b06cab67cc6e456044df3ff03911b58d8a"
    },
    "release_card": {
      "bytes": 11463,
      "name": "trice_release_card.json",
      "path": "docs/trice_release_card.json",
      "present": true,
      "sha256": "1cb68f732899f6be820d9bc7bab53b899353f3b75765efacb3ecb611fdfe6739"
    },
    "release_evidence": {
      "bytes": 195107,
      "name": "trice_release_evidence.json",
      "path": "docs/trice_release_evidence.json",
      "present": true,
      "sha256": "df413434593f41f10adb2fd2f871a7506db6aa1287e5141b206797ebab75a279"
    },
    "reproduction_card": {
      "bytes": 7294,
      "name": "trice_reproduction_card.json",
      "path": "docs/trice_reproduction_card.json",
      "present": true,
      "sha256": "74ec65592fa039648a1b78fd73f133b6abf8a528ceb848fab35416ca02436cfa"
    },
    "research_card": {
      "bytes": 69703,
      "name": "trice_research_card.json",
      "path": "docs/trice_research_card.json",
      "present": true,
      "sha256": "c1753dfa8b6c68b9bb2a1ebda01a3e37bd022a6801d2b5e136b2e94e8d77b804"
    }
  },
  "integrity_card_sha256": "44a1ceb2fc08bdba0d03469365c4539ff90dc490e447a420151fc50c3e181521",
  "integrity_level": "partial_integrity",
  "integrity_score": 90,
  "next_actions": [
    "Regenerate release evidence from current dist and CLI artifacts."
  ],
  "research_basis": [
    "SLSA and in-toto make provenance useful only when the resulting subjects and predicates are inspected by a verifier.",
    "GitHub artifact attestations cover hosted release assets, while local release evidence binds checksums, SBOMs, provenance sidecars, paper artifacts, and evidence bundles.",
    "OpenSSF Scorecard is a public health signal, but local integrity must also prove the repository's proof graph is internally consistent.",
    "TRICE integrity cards make stale README, paper, workflow, schema, and proof-card drift fail as one deterministic gate.",
    "TRICE research cards make stale or under-covered literature grounding fail before paper and README claims drift."
  ],
  "schema_version": "trice-integrity-card/v1",
  "schemas": [
    {
      "bytes": 1772,
      "name": "trice_patch_spec.schema.json",
      "path": "schemas/trice_patch_spec.schema.json",
      "present": true,
      "sha256": "11cb3f98672f04204094733b7abbddd1f744c4e3f55304e7d21fe2cb38784d9d"
    },
    {
      "bytes": 1636,
      "name": "trice_evidence_manifest.schema.json",
      "path": "schemas/trice_evidence_manifest.schema.json",
      "present": true,
      "sha256": "3541efdd44b8da389237ac730d1eb91f04e94c9e7a5efa10864031bcff649797"
    },
    {
      "bytes": 5297,
      "name": "trice_suite_manifest.schema.json",
      "path": "schemas/trice_suite_manifest.schema.json",
      "present": true,
      "sha256": "4201b9af8fd7e758fcbe19732c8f3dc817306645a3aa852f79e692ce138d9ac7"
    },
    {
      "bytes": 1337,
      "name": "trice_bundle_manifest.schema.json",
      "path": "schemas/trice_bundle_manifest.schema.json",
      "present": true,
      "sha256": "d463e12f1d23d64f65bfcc5d1b2dcfd88fe73a91015e30ddf09d600bbc6ea106"
    },
    {
      "bytes": 1757,
      "name": "trice_adapter_profile.schema.json",
      "path": "schemas/trice_adapter_profile.schema.json",
      "present": true,
      "sha256": "9a140615436a64441932a7441743182cb34d8b961996c8c81bdd4263d9054b4d"
    },
    {
      "bytes": 6008,
      "name": "trice_run_receipt.schema.json",
      "path": "schemas/trice_run_receipt.schema.json",
      "present": true,
      "sha256": "f09452661ee271cd16f823a1d833bdc781e900394a79fe70726c702f9e8f89e3"
    },
    {
      "bytes": 2041,
      "name": "trice_claim_card.schema.json",
      "path": "schemas/trice_claim_card.schema.json",
      "present": true,
      "sha256": "ebad4d1258c87c50b118d851128be648c9677a2e8df0d195afe1c07dbddfa36a"
    },
    {
      "bytes": 2315,
      "name": "trice_suite_readiness.schema.json",
      "path": "schemas/trice_suite_readiness.schema.json",
      "present": true,
      "sha256": "76ee26b1fc4c64460b1ae1d9b7d18cbabdd38fb0170f8bbcda8c04f0649a0637"
    },
    {
      "bytes": 1780,
      "name": "trice_artifact_card.schema.json",
      "path": "schemas/trice_artifact_card.schema.json",
      "present": true,
      "sha256": "8210cace6dfd646ced58aa986cfd630dc9ef29fe799083592e5bf160645427d3"
    },
    {
      "bytes": 3114,
      "name": "trice_protocol_lock.schema.json",